{
  "core_thesis": "# AI 도입에 대한 짧은 메모",
  "issues": [
    {
      "type": "overclaim",
      "claim_id": "C003",
      "detail": "Claim strength exceeds available support.",
      "text": "현재 모든 조직은 AI를 도입하지 않으면 경쟁에서 뒤처질 수밖에 없다."
    },
    {
      "type": "overclaim",
      "claim_id": "C004",
      "detail": "Claim strength exceeds available support.",
      "text": "2024년 이후 생성형 AI는 문서 작성 시간을 50% 이상 줄였고, 이로 인해 모든 팀의 생산성 문제도 해결될 것이다."
    },
    {
      "type": "causal_leap",
      "claim_id": "C004",
      "detail": "Causal wording needs direct evidence or softer framing.",
      "text": "2024년 이후 생성형 AI는 문서 작성 시간을 50% 이상 줄였고, 이로 인해 모든 팀의 생산성 문제도 해결될 것이다."
    },
    {
      "type": "overclaim",
      "claim_id": "C010",
      "detail": "Claim strength exceeds available support.",
      "text": "조직은 반드시 최신 모델을 가장 빠르게 도입해야 한다."
    }
  ],
  "repairs": [
    "Frame C004 as association, interpretation, or hypothesis unless evidence is supplied.",
    "Weaken C003 or add evidence before publication.",
    "Weaken C004 or add evidence before publication.",
    "Weaken C010 or add evidence before publication."
  ],
  "recommended_flow": [
    "Open with the practical question or central judgement.",
    "Separate factual claims from interpretation.",
    "Present the main reasoning in two to four clear moves.",
    "Add caveats where evidence is incomplete.",
    "Close with a specific judgement or action for the reader."
  ]
}
